{
  "registry_version": "0.1.0",
  "status": "seed",
  "authority_boundary": "Graph edge types are a reviewed, closed, versioned vocabulary. Generated graph edges are candidate evidence unless a local review process promotes a downstream decision.",
  "forbidden_edge_claims": [
    {
      "claim": "approved_by",
      "blocked_when": "generated graph edge or MCP graph response",
      "reason": "Approval is a human or reviewed-policy gate, never generated graph evidence.",
      "replacement": "Use review_status plus an explicit approval record pointer outside generated graph content."
    },
    {
      "claim": "verified",
      "blocked_when": "generated graph edge or MCP graph response",
      "reason": "Verification requires a reviewed validation artifact and cannot be inferred from graph structure.",
      "replacement": "Use validated_by only for declared validation artifacts and keep review_status candidate until reviewed."
    },
    {
      "claim": "trusted",
      "blocked_when": "generated graph edge or MCP graph response",
      "reason": "Trust tiers are reviewed source-policy facts, not generated graph outcomes.",
      "replacement": "Point to a reviewed trusted-source registry row when one exists."
    },
    {
      "claim": "production_ready",
      "blocked_when": "generated graph edge or MCP graph response",
      "reason": "Production readiness is a release and validation decision, not a graph relationship.",
      "replacement": "Use validation pointers and human release gates outside generated graph content."
    },
    {
      "claim": "better_than",
      "blocked_when": "generated graph edge or MCP graph response",
      "reason": "Comparative value claims require explicit evaluation methodology and review.",
      "replacement": "Use candidate comparison evidence without ranking or recommendation language."
    },
    {
      "claim": "recommended",
      "blocked_when": "generated graph edge or MCP graph response",
      "reason": "Recommendation is a decision surface and can create false authority.",
      "replacement": "Use candidate route or candidate connection wording with authority_boundary."
    },
    {
      "claim": "canonical",
      "blocked_when": "generated graph edge or MCP graph response",
      "reason": "Canon belongs to reviewed source-of-truth registries, not generated graphs.",
      "replacement": "Use reviewed registry rows or source-of-truth pointers."
    },
    {
      "claim": "authorized_by",
      "blocked_when": "generated graph edge or MCP graph response",
      "reason": "Authorization requires explicit policy and human gate evidence.",
      "replacement": "Use approval IDs in audit or enrollment records outside generated graph content."
    },
    {
      "claim": "depends_on",
      "blocked_when": "generated inference without a declared dependency field",
      "reason": "Dependency order can affect rollout and must come from a declared registry field.",
      "replacement": "Use declared.depends_on only; generated proximity can be similar_to, complements, co_used_with, or another candidate edge."
    },
    {
      "claim": "replaces",
      "blocked_when": "unreviewed generated graph edge",
      "reason": "Replacement can retire or redirect assets and requires reviewed lineage.",
      "replacement": "Use supersedes only for declared lineage evidence with review_status candidate until reviewed."
    },
    {
      "claim": "causes",
      "blocked_when": "bare generated graph edge without explicit causal methodology and review",
      "reason": "Causal language overstates candidate graph evidence.",
      "replacement": "Use evidence_for, gap_evidence_for, or another candidate non-causal relationship."
    }
  ],
  "edge_types": [
    {
      "edge_type": "learned_in",
      "edge_class": "join",
      "direction": "lesson -> repo",
      "cardinality": "many-to-one",
      "semantics": "A canonical lesson record names the repository where the lesson was learned.",
      "allowed_bases": ["lesson.repository"],
      "evidence_required": ["canonical lesson record repository field"],
      "version": "0.1.0",
      "examples": ["lesson:dad:lesson:x -> repo:example"],
      "danger_if_wrong": "Lessons can be routed to the wrong repo history.",
      "review_status": "reviewed"
    },
    {
      "edge_type": "about_asset",
      "edge_class": "join",
      "direction": "lesson -> offering",
      "cardinality": "many-to-many",
      "semantics": "A lesson evidence pointer names a registered DAD offering.",
      "allowed_bases": ["lesson.evidence.asset-ref"],
      "evidence_required": ["asset:<offering_id> evidence pointer", "registered offering id"],
      "version": "0.1.0",
      "examples": ["lesson:dad:lesson:x -> offering:dad:offering:y"],
      "danger_if_wrong": "Asset feedback and upgrade targeting can attach to the wrong offering.",
      "review_status": "reviewed"
    },
    {
      "edge_type": "matches_pattern",
      "edge_class": "join",
      "direction": "lesson -> pattern",
      "cardinality": "many-to-many",
      "semantics": "A lesson reusable-pattern value matches a reviewed pattern id or label.",
      "allowed_bases": ["lesson.reusable_patterns.pattern-id-or-label"],
      "evidence_required": ["lesson reusable_patterns entry", "reviewed pattern registry row"],
      "version": "0.1.0",
      "examples": ["lesson:dad:lesson:x -> pattern:governed_learning_loop_system"],
      "danger_if_wrong": "Pattern-gap curation can be polluted by accidental prose matches.",
      "review_status": "reviewed"
    },
    {
      "edge_type": "uses_asset",
      "edge_class": "join",
      "direction": "repo -> offering",
      "cardinality": "many-to-many",
      "semantics": "A repo usage ledger row says the repo is using an offering.",
      "allowed_bases": ["usage.status.using"],
      "evidence_required": ["repo asset usage ledger row with status using"],
      "version": "0.1.0",
      "examples": ["repo:example -> offering:dad:offering:y"],
      "danger_if_wrong": "Upgrade mail can target repos that are not using the asset.",
      "review_status": "reviewed"
    },
    {
      "edge_type": "watches_asset",
      "edge_class": "join",
      "direction": "repo -> offering",
      "cardinality": "many-to-many",
      "semantics": "A repo usage ledger row says the repo is watching an offering for possible future use.",
      "allowed_bases": ["usage.status.watching"],
      "evidence_required": ["repo asset usage ledger row with status watching"],
      "version": "0.1.0",
      "examples": ["repo:example -> offering:dad:offering:y"],
      "danger_if_wrong": "Future-use recommendations can spam repos with irrelevant upgrades.",
      "review_status": "reviewed"
    },
    {
      "edge_type": "supersedes",
      "edge_class": "join",
      "direction": "newer record -> older record",
      "cardinality": "many-to-many",
      "semantics": "A declared lineage record says one mail packet, offering, or version replaces another.",
      "allowed_bases": ["declared.supersedes"],
      "evidence_required": ["declared supersedes field or lineage record"],
      "version": "0.1.0",
      "examples": ["offering:dad:offering:v2 -> offering:dad:offering:v1"],
      "danger_if_wrong": "Repos can retire or ignore the wrong asset version.",
      "review_status": "candidate"
    },
    {
      "edge_type": "promoted_from",
      "edge_class": "join",
      "direction": "reviewed object -> intake object",
      "cardinality": "many-to-one",
      "semantics": "A reviewed asset, skill, or offering names the intake or research record it was promoted from.",
      "allowed_bases": ["declared.promoted_from"],
      "evidence_required": ["promotion approval id", "intake or research record id"],
      "version": "0.1.0",
      "examples": ["offering:dad:offering:x -> research-intake:dad:intake:y"],
      "danger_if_wrong": "Research provenance can be lost or fabricated.",
      "review_status": "candidate"
    },
    {
      "edge_type": "sighting_of",
      "edge_class": "join",
      "direction": "mail or lesson -> pattern",
      "cardinality": "many-to-many",
      "semantics": "A mail packet or lesson explicitly marks itself as a sighting of a reviewed pattern.",
      "allowed_bases": ["declared.pattern_sighting"],
      "evidence_required": ["explicit pattern sighting marker", "reviewed pattern registry row"],
      "version": "0.1.0",
      "examples": ["mail:dad:mail:x -> pattern:governed_learning_loop_system"],
      "danger_if_wrong": "Pattern mining gets inflated by vague similarities.",
      "review_status": "candidate"
    },
    {
      "edge_type": "validated_by",
      "edge_class": "join",
      "direction": "offering or harness -> eval artifact",
      "cardinality": "many-to-many",
      "semantics": "A reviewed offering or harness declares an eval case, test artifact, or validation command as supporting evidence.",
      "allowed_bases": ["declared.validation_artifact"],
      "evidence_required": ["declared validation artifact path or id"],
      "version": "0.1.0",
      "examples": ["harness:agent-instruction-code-review-red-team -> eval:labeled-cases"],
      "danger_if_wrong": "DAD can overstate promotion evidence.",
      "review_status": "candidate"
    },
    {
      "edge_type": "depends_on",
      "edge_class": "join",
      "direction": "asset -> asset",
      "cardinality": "many-to-many",
      "semantics": "A registry row explicitly declares an asset dependency.",
      "allowed_bases": ["declared.depends_on"],
      "evidence_required": ["declared dependency field"],
      "version": "0.1.0",
      "examples": ["offering:dad:offering:x -> offering:dad:offering:y"],
      "danger_if_wrong": "Update ordering and affected-repo analysis can become wrong.",
      "review_status": "candidate"
    },
    {
      "edge_type": "similar_to",
      "edge_class": "inference",